{"content":{"boundaries":[],"documentationLanguage":"en","events":[],"explanation":[],"findings":[],"id":"section-overview","interfaceContracts":[],"participants":[],"summary":{"dependencyIds":["cli-documentation:symbol:30dea2dc5cb47627d15fe5c5","cli-documentation:symbol:943e7c4c9b378cf363ac9936","cli-documentation:symbol:dd6a072510e7af3faf22eb3a"],"id":"claim-55430bd5cdb903284513","sourceIds":["cli-documentation-30dea2dc5cb47627d15f","cli-documentation-943e7c4c9b378cf363ac","cli-documentation-dd6a072510e7af3faf22"],"text":"The script maintains a source-linked navigation walkthrough. Before either branch, it verifies the recorded Git revision, source file and fragment digests, exact source text and line ranges, source URLs, and graph references. With --check, it compares expected DOT and Mermaid with saved files, parses the saved SVG, and checks that the SVG and rendered claims appear in the HTML page, then returns. It calls Graphviz as dot -Tsvg only in render_svg, reached by the branch without --check; that branch writes diagrams and replaces the page's diagram and claim sections. The check validates retained byte bindings and generated presentation, not the meaning of the agent-inferred claims. This selected source does not establish that a particular run passed or that the published diagram describes runtime execution. Syntax capture leaves call targets unresolved and provides lexical ordering only. In the explicitly labeled caller-owned local maintenance exercise, --check also rejects saved XML whose root is not an SVG element. This change is separate from the released Codeclew source. The unchanged generation branch still invokes Graphviz only without --check."},"title":"What --check verifies and when Graphviz runs"},"gap":"Describe the service purpose, scope and supported outcomes. Source-bound content has not been accepted yet.","id":"section-overview","objectId":"service:cli-documentation/section-overview","purpose":"Describe the service purpose, scope and supported outcomes.","required":true,"schema":"codeclew-documentation-section/1.0","service":"cli-documentation","status":"AUTHORED","title":"Overview","workRequest":{"audience":"Service maintainers and architecture readers","entrypoint":"section-overview","maxBytes":40960,"maxItems":20,"schema":"codeclew-documentation-work-request/1.0"}}
