{"content":{"boundaries":[],"documentationLanguage":"en","events":[],"explanation":[],"findings":[],"id":"section-responsibilities","interfaceContracts":[],"participants":[],"summary":{"dependencyIds":["cli-documentation:symbol:30dea2dc5cb47627d15fe5c5","cli-documentation:symbol:943e7c4c9b378cf363ac9936","cli-documentation:symbol:cd96038866bf7f18d601a02e"],"id":"claim-1a46841238c509a3c268","sourceIds":["cli-documentation-30dea2dc5cb47627d15f","cli-documentation-943e7c4c9b378cf363ac","cli-documentation-cd96038866bf7f18d601"],"text":"This script verifies the byte bindings of recorded claims and generates their diagram and HTML presentation. It checks exact committed source, retained source digests and references; it labels the graph as agent-interpreted static flow. It does not determine whether the claims are semantically true or establish runtime behavior. Graphviz contributes SVG rendering on the generation branch. These responsibilities describe the selected source file; they do not establish deployed ownership or a successful run."},"title":"Byte-binding verification and presentation"},"gap":"Describe responsibilities and exclusions from evidence; business intent may need a human note. Source-bound content has not been accepted yet.","id":"section-responsibilities","objectId":"service:cli-documentation/section-responsibilities","purpose":"Describe responsibilities and exclusions from evidence; business intent may need a human note.","required":true,"schema":"codeclew-documentation-section/1.0","service":"cli-documentation","status":"AUTHORED","title":"Responsibilities","workRequest":{"audience":"Service maintainers and architecture readers","entrypoint":"section-responsibilities","maxBytes":40960,"maxItems":20,"schema":"codeclew-documentation-work-request/1.0"}}
